{
  "id": "norac-bed",
  "isPublished": true,
  "categoryId": "bedroom",
  "materialIds": [
    "oak"
  ],
  "collectionIds": [
    "norac"
  ],
  "galleryAssetIds": [
    "norac-bed-1",
    "norac-bed-2"
  ],
  "dimensions": {},
  "source": "https://normod.com/products/norac-ahsap-karyola",
  "verifiedAt": "2026-09-15",
  "sortOrder": 6,
  "relatedIds": [
    "norac-bedside",
    "norac-dresser",
    "norac-tv"
  ]
}
